Question Keywords,Answer
plastic bottle,"Switch from PET bottles to bamboo, glass, or stainless steel bottles."
straw,"Use paper, bamboo, or metal straws as alternatives."
packaging,Compostable packaging from cornstarch or mushroom material works well.
microplastic,Avoid cosmetic products with polyethylene beads.
bag,"Use jute, cotton, or biodegradable bags."
cutlery,"Use bamboo, wooden, or cornstarch-based cutlery."
toothbrush,Try bamboo toothbrushes instead of plastic ones.
cosmetic,Look for biodegradable or zero-microplastic cosmetic products.
